{
  "id": "1",
  "index": 1,
  "total": 177,
  "docId": "urn:cts:latinLit:phi0690.phi003.perseus-lat1",
  "cite": "6.1",
  "text": "Sic fatur lacrimans, classique immittit habenas, et tandem Euboicis Cumarum adlabitur oris.",
  "provider": "Perseus AGLDT v2.1",
  "version": "2.1",
  "nodes": [
    { "id": 0,  "form": "[0]",                                      "isRoot": true,  "artificial": true },
    { "id": 1,  "form": "Sic",       "lemma": "sic",     "pos": "ADV",                       "label": "ADV",                   "isRoot": false },
    { "id": 2,  "form": "fatur",     "lemma": "for",     "pos": "VERB",  "morph": "3SG PRES.IND",      "label": "VERB · 3SG PRES.IND",   "isRoot": false },
    { "id": 3,  "form": "lacrimans", "lemma": "lacrimo", "pos": "VERB",  "morph": "PRES.PTCP NOM.SG",  "label": "VERB · PRES.PTCP NOM.SG","isRoot": false },
    { "id": 4,  "form": ",",         "lemma": "comma",   "pos": "PUNCT",                     "label": "PUNCT",                 "isRoot": false },
    { "id": 5,  "form": "classi",    "lemma": "classis", "pos": "NOUN",  "morph": "DAT.SG",            "label": "NOUN · DAT.SG",         "isRoot": false },
    { "id": 6,  "form": "-que",      "lemma": "-que",    "pos": "CONJ",                      "label": "CONJ",                  "isRoot": false },
    { "id": 7,  "form": "immittit",  "lemma": "immitto", "pos": "VERB",  "morph": "3SG PRES.IND",      "label": "VERB · 3SG PRES.IND",   "isRoot": false },
    { "id": 8,  "form": "habenas",   "lemma": "habena",  "pos": "NOUN",  "morph": "ACC.PL",            "label": "NOUN · ACC.PL",         "isRoot": false },
    { "id": 9,  "form": ",",         "lemma": "comma",   "pos": "PUNCT",                     "label": "PUNCT",                 "isRoot": false },
    { "id": 10, "form": "et",        "lemma": "et",      "pos": "CONJ",                      "label": "CONJ",                  "isRoot": false },
    { "id": 11, "form": "tandem",    "lemma": "tandem",  "pos": "ADV",                       "label": "ADV",                   "isRoot": false },
    { "id": 12, "form": "Euboicis",  "lemma": "Euboicus","pos": "ADJ",   "morph": "DAT.PL",            "label": "ADJ · DAT.PL",          "isRoot": false },
    { "id": 13, "form": "Cumarum",   "lemma": "Cumae",   "pos": "NOUN",  "morph": "GEN.PL",            "label": "NOUN · GEN.PL",         "isRoot": false },
    { "id": 14, "form": "adlabitur", "lemma": "allabor", "pos": "VERB",  "morph": "3SG PRES.IND",      "label": "VERB · 3SG PRES.IND",   "isRoot": false },
    { "id": 15, "form": "oris",      "lemma": "ora",     "pos": "NOUN",  "morph": "DAT.PL",            "label": "NOUN · DAT.PL",         "isRoot": false },
    { "id": 16, "form": ".",         "lemma": "punc",    "pos": "PUNCT",                     "label": "PUNCT",                 "isRoot": false }
  ],
  "edges": [
    { "from": 2,  "to": 1,  "relation": "AuxY"    },
    { "from": 10, "to": 2,  "relation": "PRED_CO" },
    { "from": 2,  "to": 3,  "relation": "ADV"     },
    { "from": 10, "to": 4,  "relation": "AuxX"    },
    { "from": 7,  "to": 5,  "relation": "OBJ"     },
    { "from": 10, "to": 6,  "relation": "AuxY"    },
    { "from": 10, "to": 7,  "relation": "PRED_CO" },
    { "from": 7,  "to": 8,  "relation": "OBJ"     },
    { "from": 10, "to": 9,  "relation": "AuxX"    },
    { "from": 0,  "to": 10, "relation": "COORD"   },
    { "from": 14, "to": 11, "relation": "AuxY"    },
    { "from": 15, "to": 12, "relation": "ATR"     },
    { "from": 15, "to": 13, "relation": "ATR"     },
    { "from": 10, "to": 14, "relation": "PRED_CO" },
    { "from": 14, "to": 15, "relation": "OBJ"     },
    { "from": 0,  "to": 16, "relation": "AuxK"    }
  ]
}
